<?xml version="1.0"?>
<!DOCTYPE Report
[
<!ELEMENT Report (General ,(Doc|BPT)) >
<!ATTLIST Report ver CDATA #REQUIRED tmZone CDATA #REQUIRED>

<!ELEMENT General ( DocLocation ) >
<!ATTLIST General productName CDATA #REQUIRED productVer CDATA #REQUIRED os CDATA #REQUIRED host CDATA #REQUIRED qcserver CDATA #IMPLIED qcproject CDATA #IMPLIED SolManSolutionId CDATA #IMPLIED SolManProjectId CDATA #IMPLIED SolManTestPlanId CDATA #IMPLIED SolManTestPackageId CDATA #IMPLIED SolManUserInfoData CDATA #IMPLIED  >

<!ELEMENT BPT (DName,Res,DVer?,TSet?,TInst?,NodeArgs,AdditionalInfo*,Doc*) >
<!ATTLIST BPT rID ID #REQUIRED >

<!ELEMENT Doc (DName,ConfName?,Res,DVer?,TSet?,TInst?,RunType?,DT?,AdditionalInfo*,Step*,DIter*,Step*,Action*,Doc*,Summary?,TestMaintenanceSummary*,NodeArgs?) >
<!ATTLIST Doc rID ID #REQUIRED type (Test|BC|BPTWrapperTest|Flow|Group|Action) "Test" productName CDATA #REQUIRED BCIter CDATA #IMPLIED >

<!ELEMENT RunType ( #PCDATA )>
<!ATTLIST RunType fmStep (False|True) "False" batch (False|True) "False" upDesc (False|True) "False" upChk (False|True) "False" upAS (False|True) "False">

<!ELEMENT DName ( #PCDATA ) >

<!ELEMENT ConfName ( #PCDATA ) >

<!ELEMENT Res ( #PCDATA ) >

<!ELEMENT AdditionalInfo (AdditionalDataName,AdditionalDataValue ) >

<!ELEMENT AdditionalDataName ( #PCDATA ) >

<!ELEMENT AdditionalDataValue ( #PCDATA ) >

<!ELEMENT DVer ( #PCDATA ) >

<!ELEMENT TSet ( #PCDATA ) >

<!ELEMENT TInst ( #PCDATA ) >

<!ELEMENT DIter (Step*,Action+,Summary?,NodeArgs)>
<!ATTLIST DIter rID ID #REQUIRED iterID CDATA #REQUIRED>

<!ELEMENT DocLocation ( #PCDATA )>

<!ELEMENT Action (AName,AIter*,(Step|HtmlStep|Action)*, Summary,ActionMaintenanceSummary*, NodeArgs ) >
<!ATTLIST Action rID ID #REQUIRED>

<!ELEMENT AIter ((Step|HtmlStep|Action)*,DataMapping?, Summary?,NodeArgs) >
<!ATTLIST AIter rID ID #REQUIRED iterID CDATA #REQUIRED isCountable (False|True) "False" >

<!ELEMENT AName ( #PCDATA ) >

<!ELEMENT TestMaintenanceSummary (ActionMaintenanceSummary*) >
<!ATTLIST TestMaintenanceSummary ObjectsAdded CDATA #REQUIRED ObjectsUpdated CDATA #REQUIRED StepsUpdated CDATA #REQUIRED StepsComments CDATA #REQUIRED><!ELEMENT ActionMaintenanceSummary (ObjectChange* ) >
<!ATTLIST ActionMaintenanceSummary Action CDATA #REQUIRED Objects CDATA #REQUIRED Updated CDATA #REQUIRED LinesTotal CDATA #REQUIRED Added CDATA #REQUIRED LinesUpdated CDATA #REQUIRED>

<!ELEMENT ObjectChange  (Hierarchy, PropertyChangeList* ) >
<!ATTLIST ObjectChange Operation CDATA #IMPLIED OriginalRepository CDATA #IMPLIED>

<!ELEMENT PropertyChangeList (PropertyDef*) >

<!ELEMENT PropertyDef (OriginalValue, NewValue) >
<!ATTLIST PropertyDef PropName CDATA #REQUIRED OriginRegularExpression (True|False) "False" NewRegularExpression (True|False) "False" AddedProperty (True|False) "False" >

<!ELEMENT OriginalValue ( #PCDATA )>

<!ELEMENT NewValue ( #PCDATA )>

<!ELEMENT Hierarchy  (ObjectName, Hierarchy*) >
<!ATTLIST Hierarchy MicClass CDATA #REQUIRED>

<!ELEMENT ObjectName  ( #PCDATA ) >

<!ELEMENT Step (Obj,Details,Time,TimeTick* ,(Step|HtmlStep|Doc)*, DataMapping?, NodeArgs) >
<!ATTLIST Step rID ID #REQUIRED retval CDATA #IMPLIED>

<!ELEMENT HtmlStep (HTML,TimeTick*,(Step|HtmlStep|Doc)*,NodeArgs) >
<!ATTLIST HtmlStep rID ID #REQUIRED >

<!ELEMENT Obj ( #PCDATA ) >
<!ATTLIST Obj plainTxt (False|True) "True">

<!ELEMENT Details ( #PCDATA ) >
<!ATTLIST Details plainTxt (False|True) "True">

<!ELEMENT Time ( #PCDATA ) >

<!ELEMENT HTML ( #PCDATA ) >

<!ELEMENT Disp ( #PCDATA ) >

<!ELEMENT TimeTick ( #PCDATA ) >

<!ELEMENT DataMapping ( DataMappedItem* )>
<!ELEMENT DataMappedItem EMPTY >
<!ATTLIST DataMappedItem dsName CDATA #REQUIRED >
<!ATTLIST DataMappedItem rowId CDATA #REQUIRED >

<!ELEMENT NodeArgs (Disp,TopPane?,BtmPane?,ExtendedInfo? )>
<!ATTLIST NodeArgs eType CDATA #REQUIRED icon CDATA #REQUIRED nRep CDATA #REQUIRED UserNote CDATA #IMPLIED filter (False|True) "True">
<!ATTLIST NodeArgs status (Passed|Failed|Done|Warning|Information) "Done">
<!ATTLIST NodeArgs iconSel CDATA #IMPLIED nType CDATA #IMPLIED MovieMarker CDATA "">
<!ATTLIST NodeArgs Source CDATA #IMPLIED SourceLine CDATA #IMPLIED StepFlowItemKey CDATA #IMPLIED >

<!ELEMENT TopPane (Path)>

<!ELEMENT BtmPane ( (Path|WR)?,ASHilite?)>
<!ATTLIST BtmPane vType CDATA "HTML">

<!ELEMENT Path ( #PCDATA ) >

<!ELEMENT ASHilite ( #PCDATA ) >

<!ELEMENT WR ( #PCDATA ) >

<!ELEMENT ExtendedInfo ( StepData ) >

<!ATTLIST ExtendedInfo StepType CDATA #REQUIRED>
<!ELEMENT DT (NodeArgs) >
<!ATTLIST DT rID ID #REQUIRED>

<!ELEMENT Summary (Param*)>
<!ATTLIST Summary sTime CDATA #IMPLIED eTime CDATA #IMPLIED passed CDATA #IMPLIED failed CDATA #IMPLIED warnings CDATA #IMPLIED retval CDATA #IMPLIED stopped (False|True) "False" >

<!ELEMENT Param (ParamName,ParamVal)+ >
<!ATTLIST Param paramInOut (In|Out) "In">

<!ELEMENT ParamName ( #PCDATA ) >

<!ELEMENT ParamVal ( #PCDATA ) >

]
>
<Report ver="2.0" tmZone="India Standard Time">
<General productName="HP Unified Functional Testing" productVer="12.01" os="Windows 7" host="HW2314"><DocLocation><![CDATA[C:\IFSAutomation\Branch_IFS_Documents_Final\Branch_IFS_Documents_Final\Drivers\SuiteDriver]]></DocLocation></General>
<Doc rID="T1"   productName= "HP Unified Functional Testing"  >
<DName><![CDATA[SuiteDriver]]></DName>
<Res><![CDATA[Res203]]></Res>
<DT rID="T2">
<NodeArgs eType="Table" icon="2" nRep="4" filter="False" >
<Disp><![CDATA[Run-Time Data Table]]></Disp>
<BtmPane vType="Table" >
<Path><![CDATA[Default.xls]]></Path>
</BtmPane>
</NodeArgs>
</DT>
<Action rID="T3">
<AName><![CDATA[Action1]]></AName>
<Step rID="T4">
<Obj plainTxt="False" ><![CDATA[SystemUtil]]></Obj>
<Details plainTxt="False" ><![CDATA[SystemUtil]]></Details>
<Time><![CDATA[04-05-2016 - 14:16:29]]></Time>
<TimeTick>1462351589</TimeTick>
<Step rID="T5">
<Obj plainTxt="False" ><![CDATA[Run "iexplore.exe",3]]></Obj>
<Details plainTxt="False" ><![CDATA[Run "iexplore.exe",3]]></Details>
<Time><![CDATA[04-05-2016 - 14:16:29]]></Time>
<TimeTick>1462351589</TimeTick>
<NodeArgs eType="Replay" icon="4" nRep="10" status="Passed" >
<Disp><![CDATA[Run "iexplore.exe",3]]></Disp>
</NodeArgs>
</Step>
<NodeArgs eType="Replay" icon="4" nRep="9" status="Passed" >
<Disp><![CDATA[SystemUtil]]></Disp>
</NodeArgs>
</Step>
<Step rID="T6">
<Obj plainTxt="False" ><![CDATA[Login]]></Obj>
<Details plainTxt="False" ><![CDATA[Browser]]></Details>
<Time><![CDATA[04-05-2016 - 14:16:31]]></Time>
<TimeTick>1462351591</TimeTick>
<Step rID="T7">
<Obj plainTxt="False" ><![CDATA[Login.Sync]]></Obj>
<Details plainTxt="False" ><![CDATA[]]></Details>
<Time><![CDATA[04-05-2016 - 14:16:31]]></Time>
<TimeTick>1462351591</TimeTick>
<NodeArgs eType="Replay" icon="5" nRep="20" >
<Disp><![CDATA[Login.Sync]]></Disp>
</NodeArgs>
</Step>
<NodeArgs eType="Context" icon="5" nRep="19" >
<Disp><![CDATA[Login]]></Disp>
</NodeArgs>
</Step>
<Step rID="T8">
<Obj ><![CDATA[Login]]></Obj>
<Details ><![CDATA[]]></Details>
<Time><![CDATA[04-05-2016 - 14:16:31]]></Time>
<TimeTick>1462351591</TimeTick>
<NodeArgs eType="User" icon="6" nRep="21" status="Passed" >
<Disp><![CDATA[Login]]></Disp>
</NodeArgs>
</Step>
<Step rID="T9">
<Obj plainTxt="False" ><![CDATA[Login]]></Obj>
<Details plainTxt="False" ><![CDATA[Browser]]></Details>
<Time><![CDATA[04-05-2016 - 14:16:33]]></Time>
<TimeTick>1462351593</TimeTick>
<Step rID="T10">
<Obj plainTxt="False" ><![CDATA[Login]]></Obj>
<Details plainTxt="False" ><![CDATA[Page]]></Details>
<Time><![CDATA[04-05-2016 - 14:16:33]]></Time>
<TimeTick>1462351593</TimeTick>
<Step rID="T11">
<Obj plainTxt="False" ><![CDATA[TXT_user_name.Exist]]></Obj>
<Details plainTxt="False" ><![CDATA["Object exists"]]></Details>
<Time><![CDATA[04-05-2016 - 14:16:33]]></Time>
<TimeTick>1462351593</TimeTick>
<NodeArgs eType="Replay" icon="8" nRep="42" >
<Disp><![CDATA[TXT_user_name.Exist]]></Disp>
</NodeArgs>
</Step>
<Step rID="T12">
<Obj plainTxt="False" ><![CDATA[TXT_user_name.Set]]></Obj>
<Details plainTxt="False" ><![CDATA["chrisj"]]></Details>
<Time><![CDATA[04-05-2016 - 14:16:33]]></Time>
<TimeTick>1462351593</TimeTick>
<NodeArgs eType="Replay" icon="8" nRep="44" >
<Disp><![CDATA[TXT_user_name.Set]]></Disp>
</NodeArgs>
</Step>
<NodeArgs eType="Context" icon="7" nRep="41" >
<Disp><![CDATA[Login]]></Disp>
</NodeArgs>
</Step>
<NodeArgs eType="Context" icon="5" nRep="40" >
<Disp><![CDATA[Login]]></Disp>
</NodeArgs>
</Step>
<Step rID="T13">
<Obj ><![CDATA[Login]]></Obj>
<Details ><![CDATA[]]></Details>
<Time><![CDATA[04-05-2016 - 14:16:33]]></Time>
<TimeTick>1462351593</TimeTick>
<NodeArgs eType="User" icon="6" nRep="45" status="Passed" >
<Disp><![CDATA[Login]]></Disp>
</NodeArgs>
</Step>
<Step rID="T14">
<Obj plainTxt="False" ><![CDATA[Login]]></Obj>
<Details plainTxt="False" ><![CDATA[Browser]]></Details>
<Time><![CDATA[04-05-2016 - 14:16:33]]></Time>
<TimeTick>1462351593</TimeTick>
<Step rID="T15">
<Obj plainTxt="False" ><![CDATA[Login]]></Obj>
<Details plainTxt="False" ><![CDATA[Page]]></Details>
<Time><![CDATA[04-05-2016 - 14:16:33]]></Time>
<TimeTick>1462351593</TimeTick>
<Step rID="T16">
<Obj plainTxt="False" ><![CDATA[TXT_user_password.Exist]]></Obj>
<Details plainTxt="False" ><![CDATA["Object exists"]]></Details>
<Time><![CDATA[04-05-2016 - 14:16:33]]></Time>
<TimeTick>1462351593</TimeTick>
<NodeArgs eType="Replay" icon="8" nRep="49" >
<Disp><![CDATA[TXT_user_password.Exist]]></Disp>
</NodeArgs>
</Step>
<Step rID="T17">
<Obj plainTxt="False" ><![CDATA[TXT_user_password.Set]]></Obj>
<Details plainTxt="False" ><![CDATA["password"]]></Details>
<Time><![CDATA[04-05-2016 - 14:16:33]]></Time>
<TimeTick>1462351593</TimeTick>
<NodeArgs eType="Replay" icon="8" nRep="51" >
<Disp><![CDATA[TXT_user_password.Set]]></Disp>
</NodeArgs>
</Step>
<NodeArgs eType="Context" icon="7" nRep="48" >
<Disp><![CDATA[Login]]></Disp>
</NodeArgs>
</Step>
<NodeArgs eType="Context" icon="5" nRep="47" >
<Disp><![CDATA[Login]]></Disp>
</NodeArgs>
</Step>
<Step rID="T18">
<Obj ><![CDATA[Login]]></Obj>
<Details ><![CDATA[]]></Details>
<Time><![CDATA[04-05-2016 - 14:16:33]]></Time>
<TimeTick>1462351593</TimeTick>
<NodeArgs eType="User" icon="6" nRep="52" status="Passed" >
<Disp><![CDATA[Login]]></Disp>
</NodeArgs>
</Step>
<Step rID="T19">
<Obj plainTxt="False" ><![CDATA[Login]]></Obj>
<Details plainTxt="False" ><![CDATA[Browser]]></Details>
<Time><![CDATA[04-05-2016 - 14:16:33]]></Time>
<TimeTick>1462351593</TimeTick>
<Step rID="T20">
<Obj plainTxt="False" ><![CDATA[Login]]></Obj>
<Details plainTxt="False" ><![CDATA[Page]]></Details>
<Time><![CDATA[04-05-2016 - 14:16:33]]></Time>
<TimeTick>1462351593</TimeTick>
<Step rID="T21">
<Obj plainTxt="False" ><![CDATA[BTN_Log In.Exist]]></Obj>
<Details plainTxt="False" ><![CDATA["Object exists"]]></Details>
<Time><![CDATA[04-05-2016 - 14:16:33]]></Time>
<TimeTick>1462351593</TimeTick>
<NodeArgs eType="Replay" icon="9" nRep="56" >
<Disp><![CDATA[BTN_Log In.Exist]]></Disp>
</NodeArgs>
</Step>
<Step rID="T22">
<Obj plainTxt="False" ><![CDATA[BTN_Log In.Click]]></Obj>
<Details plainTxt="False" ><![CDATA[]]></Details>
<Time><![CDATA[04-05-2016 - 14:16:36]]></Time>
<TimeTick>1462351596</TimeTick>
<NodeArgs eType="Replay" icon="9" nRep="58" >
<Disp><![CDATA[BTN_Log In.Click]]></Disp>
</NodeArgs>
</Step>
<NodeArgs eType="Context" icon="7" nRep="55" >
<Disp><![CDATA[Login]]></Disp>
</NodeArgs>
</Step>
<NodeArgs eType="Context" icon="5" nRep="54" >
<Disp><![CDATA[Login]]></Disp>
</NodeArgs>
</Step>
<Step rID="T23">
<Obj ><![CDATA[Login]]></Obj>
<Details ><![CDATA[]]></Details>
<Time><![CDATA[04-05-2016 - 14:16:36]]></Time>
<TimeTick>1462351596</TimeTick>
<NodeArgs eType="User" icon="6" nRep="59" status="Passed" >
<Disp><![CDATA[Login]]></Disp>
</NodeArgs>
</Step>
<Step rID="T24">
<Obj plainTxt="False" ><![CDATA[Work Queue]]></Obj>
<Details plainTxt="False" ><![CDATA[Browser]]></Details>
<Time><![CDATA[04-05-2016 - 14:16:38]]></Time>
<TimeTick>1462351598</TimeTick>
<Step rID="T25">
<Obj plainTxt="False" ><![CDATA[Work Queue]]></Obj>
<Details plainTxt="False" ><![CDATA[Page]]></Details>
<Time><![CDATA[04-05-2016 - 14:16:38]]></Time>
<TimeTick>1462351598</TimeTick>
<Step rID="T26">
<Obj plainTxt="False" ><![CDATA[TAB _Home.Exist]]></Obj>
<Details plainTxt="False" ><![CDATA["Object exists"]]></Details>
<Time><![CDATA[04-05-2016 - 14:16:38]]></Time>
<TimeTick>1462351598</TimeTick>
<NodeArgs eType="Replay" icon="10" nRep="63" >
<Disp><![CDATA[TAB _Home.Exist]]></Disp>
</NodeArgs>
</Step>
<Step rID="T27">
<Obj plainTxt="False" ><![CDATA[Work Queue.Sync]]></Obj>
<Details plainTxt="False" ><![CDATA[]]></Details>
<Time><![CDATA[04-05-2016 - 14:16:38]]></Time>
<TimeTick>1462351598</TimeTick>
<NodeArgs eType="Replay" icon="7" nRep="65" >
<Disp><![CDATA[Work Queue.Sync]]></Disp>
</NodeArgs>
</Step>
<Step rID="T28">
<Obj plainTxt="False" ><![CDATA[TAB _Home.Exist]]></Obj>
<Details plainTxt="False" ><![CDATA["Object exists"]]></Details>
<Time><![CDATA[04-05-2016 - 14:16:40]]></Time>
<TimeTick>1462351600</TimeTick>
<NodeArgs eType="Replay" icon="10" nRep="67" >
<Disp><![CDATA[TAB _Home.Exist]]></Disp>
</NodeArgs>
</Step>
<NodeArgs eType="Context" icon="7" nRep="62" >
<Disp><![CDATA[Work Queue]]></Disp>
</NodeArgs>
</Step>
<NodeArgs eType="Context" icon="5" nRep="61" >
<Disp><![CDATA[Work Queue]]></Disp>
</NodeArgs>
</Step>
<Step rID="T29">
<Obj ><![CDATA[Login]]></Obj>
<Details ><![CDATA[]]></Details>
<Time><![CDATA[04-05-2016 - 14:16:40]]></Time>
<TimeTick>1462351600</TimeTick>
<NodeArgs eType="User" icon="6" nRep="68" status="Passed" >
<Disp><![CDATA[Login]]></Disp>
</NodeArgs>
</Step>
<Step rID="T30">
<Obj plainTxt="False" ><![CDATA[Work Queue]]></Obj>
<Details plainTxt="False" ><![CDATA[Browser]]></Details>
<Time><![CDATA[04-05-2016 - 14:16:40]]></Time>
<TimeTick>1462351600</TimeTick>
<Step rID="T31">
<Obj plainTxt="False" ><![CDATA[Work Queue]]></Obj>
<Details plainTxt="False" ><![CDATA[Page]]></Details>
<Time><![CDATA[04-05-2016 - 14:16:40]]></Time>
<TimeTick>1462351600</TimeTick>
<Step rID="T32">
<Obj plainTxt="False" ><![CDATA[TAB _Home.Exist]]></Obj>
<Details plainTxt="False" ><![CDATA["Object exists"]]></Details>
<Time><![CDATA[04-05-2016 - 14:16:40]]></Time>
<TimeTick>1462351600</TimeTick>
<NodeArgs eType="Replay" icon="10" nRep="72" >
<Disp><![CDATA[TAB _Home.Exist]]></Disp>
</NodeArgs>
</Step>
<NodeArgs eType="Context" icon="7" nRep="71" >
<Disp><![CDATA[Work Queue]]></Disp>
</NodeArgs>
</Step>
<NodeArgs eType="Context" icon="5" nRep="70" >
<Disp><![CDATA[Work Queue]]></Disp>
</NodeArgs>
</Step>
<Step rID="T33">
<Obj ><![CDATA[NavigatetoEditNonEdit]]></Obj>
<Details ><![CDATA[]]></Details>
<Time><![CDATA[04-05-2016 - 14:16:40]]></Time>
<TimeTick>1462351600</TimeTick>
<NodeArgs eType="User" icon="6" nRep="73" status="Passed" >
<Disp><![CDATA[NavigatetoEditNonEdit]]></Disp>
</NodeArgs>
</Step>
<Step rID="T34">
<Obj plainTxt="False" ><![CDATA[Work Queue]]></Obj>
<Details plainTxt="False" ><![CDATA[Browser]]></Details>
<Time><![CDATA[04-05-2016 - 14:16:40]]></Time>
<TimeTick>1462351600</TimeTick>
<Step rID="T35">
<Obj plainTxt="False" ><![CDATA[Work Queue]]></Obj>
<Details plainTxt="False" ><![CDATA[Page]]></Details>
<Time><![CDATA[04-05-2016 - 14:16:40]]></Time>
<TimeTick>1462351600</TimeTick>
<Step rID="T36">
<Obj plainTxt="False" ><![CDATA[TAB_Tests.Exist]]></Obj>
<Details plainTxt="False" ><![CDATA["Object exists"]]></Details>
<Time><![CDATA[04-05-2016 - 14:16:40]]></Time>
<TimeTick>1462351600</TimeTick>
<NodeArgs eType="Replay" icon="10" nRep="77" >
<Disp><![CDATA[TAB_Tests.Exist]]></Disp>
</NodeArgs>
</Step>
<NodeArgs eType="Context" icon="7" nRep="76" >
<Disp><![CDATA[Work Queue]]></Disp>
</NodeArgs>
</Step>
<NodeArgs eType="Context" icon="5" nRep="75" >
<Disp><![CDATA[Work Queue]]></Disp>
</NodeArgs>
</Step>
<Step rID="T37">
<Obj ><![CDATA[NavigatetoEditNonEdit]]></Obj>
<Details ><![CDATA[]]></Details>
<Time><![CDATA[04-05-2016 - 14:16:40]]></Time>
<TimeTick>1462351600</TimeTick>
<NodeArgs eType="User" icon="6" nRep="78" status="Passed" >
<Disp><![CDATA[NavigatetoEditNonEdit]]></Disp>
</NodeArgs>
</Step>
<Step rID="T38">
<Obj plainTxt="False" ><![CDATA[Work Queue]]></Obj>
<Details plainTxt="False" ><![CDATA[Browser]]></Details>
<Time><![CDATA[04-05-2016 - 14:16:40]]></Time>
<TimeTick>1462351600</TimeTick>
<Step rID="T39">
<Obj plainTxt="False" ><![CDATA[Work Queue]]></Obj>
<Details plainTxt="False" ><![CDATA[Page]]></Details>
<Time><![CDATA[04-05-2016 - 14:16:40]]></Time>
<TimeTick>1462351600</TimeTick>
<Step rID="T40">
<Obj plainTxt="False" ><![CDATA[TAB_Tests.Exist]]></Obj>
<Details plainTxt="False" ><![CDATA["Object exists"]]></Details>
<Time><![CDATA[04-05-2016 - 14:16:40]]></Time>
<TimeTick>1462351600</TimeTick>
<NodeArgs eType="Replay" icon="10" nRep="82" >
<Disp><![CDATA[TAB_Tests.Exist]]></Disp>
</NodeArgs>
</Step>
<Step rID="T41">
<Obj plainTxt="False" ><![CDATA[TAB_Tests.Click]]></Obj>
<Details plainTxt="False" ><![CDATA[]]></Details>
<Time><![CDATA[04-05-2016 - 14:16:41]]></Time>
<TimeTick>1462351601</TimeTick>
<NodeArgs eType="Replay" icon="10" nRep="84" >
<Disp><![CDATA[TAB_Tests.Click]]></Disp>
</NodeArgs>
</Step>
<NodeArgs eType="Context" icon="7" nRep="81" >
<Disp><![CDATA[Work Queue]]></Disp>
</NodeArgs>
</Step>
<NodeArgs eType="Context" icon="5" nRep="80" >
<Disp><![CDATA[Work Queue]]></Disp>
</NodeArgs>
</Step>
<Step rID="T42">
<Obj ><![CDATA[NavigatetoEditNonEdit]]></Obj>
<Details ><![CDATA[]]></Details>
<Time><![CDATA[04-05-2016 - 14:16:41]]></Time>
<TimeTick>1462351601</TimeTick>
<NodeArgs eType="User" icon="6" nRep="85" status="Passed" >
<Disp><![CDATA[NavigatetoEditNonEdit]]></Disp>
</NodeArgs>
</Step>
<Step rID="T43">
<Obj plainTxt="False" ><![CDATA[Work Queue]]></Obj>
<Details plainTxt="False" ><![CDATA[Browser]]></Details>
<Time><![CDATA[04-05-2016 - 14:16:41]]></Time>
<TimeTick>1462351601</TimeTick>
<Step rID="T44">
<Obj plainTxt="False" ><![CDATA[Work Queue]]></Obj>
<Details plainTxt="False" ><![CDATA[Page]]></Details>
<Time><![CDATA[04-05-2016 - 14:16:41]]></Time>
<TimeTick>1462351601</TimeTick>
<Step rID="T45">
<Obj plainTxt="False" ><![CDATA[LNK_QuestionsReadOnly.Exist]]></Obj>
<Details plainTxt="False" ><![CDATA["Object exists"]]></Details>
<Time><![CDATA[04-05-2016 - 14:16:41]]></Time>
<TimeTick>1462351601</TimeTick>
<NodeArgs eType="Replay" icon="10" nRep="89" >
<Disp><![CDATA[LNK_QuestionsReadOnly.Exist]]></Disp>
</NodeArgs>
</Step>
<NodeArgs eType="Context" icon="7" nRep="88" >
<Disp><![CDATA[Work Queue]]></Disp>
</NodeArgs>
</Step>
<NodeArgs eType="Context" icon="5" nRep="87" >
<Disp><![CDATA[Work Queue]]></Disp>
</NodeArgs>
</Step>
<Step rID="T46">
<Obj ><![CDATA[NavigatetoEditNonEdit]]></Obj>
<Details ><![CDATA[]]></Details>
<Time><![CDATA[04-05-2016 - 14:16:41]]></Time>
<TimeTick>1462351601</TimeTick>
<NodeArgs eType="User" icon="6" nRep="90" status="Passed" >
<Disp><![CDATA[NavigatetoEditNonEdit]]></Disp>
</NodeArgs>
</Step>
<Step rID="T47">
<Obj plainTxt="False" ><![CDATA[Work Queue]]></Obj>
<Details plainTxt="False" ><![CDATA[Browser]]></Details>
<Time><![CDATA[04-05-2016 - 14:16:42]]></Time>
<TimeTick>1462351602</TimeTick>
<Step rID="T48">
<Obj plainTxt="False" ><![CDATA[Work Queue]]></Obj>
<Details plainTxt="False" ><![CDATA[Page]]></Details>
<Time><![CDATA[04-05-2016 - 14:16:42]]></Time>
<TimeTick>1462351602</TimeTick>
<Step rID="T49">
<Obj plainTxt="False" ><![CDATA[LNK_QuestionsReadOnly.Exist]]></Obj>
<Details plainTxt="False" ><![CDATA["Object exists"]]></Details>
<Time><![CDATA[04-05-2016 - 14:16:42]]></Time>
<TimeTick>1462351602</TimeTick>
<NodeArgs eType="Replay" icon="10" nRep="94" >
<Disp><![CDATA[LNK_QuestionsReadOnly.Exist]]></Disp>
</NodeArgs>
</Step>
<Step rID="T50">
<Obj plainTxt="False" ><![CDATA[LNK_QuestionsReadOnly.Click]]></Obj>
<Details plainTxt="False" ><![CDATA[]]></Details>
<Time><![CDATA[04-05-2016 - 14:16:42]]></Time>
<TimeTick>1462351602</TimeTick>
<NodeArgs eType="Replay" icon="10" nRep="96" >
<Disp><![CDATA[LNK_QuestionsReadOnly.Click]]></Disp>
</NodeArgs>
</Step>
<NodeArgs eType="Context" icon="7" nRep="93" >
<Disp><![CDATA[Work Queue]]></Disp>
</NodeArgs>
</Step>
<NodeArgs eType="Context" icon="5" nRep="92" >
<Disp><![CDATA[Work Queue]]></Disp>
</NodeArgs>
</Step>
<Step rID="T51">
<Obj ><![CDATA[NavigatetoEditNonEdit]]></Obj>
<Details ><![CDATA[]]></Details>
<Time><![CDATA[04-05-2016 - 14:16:42]]></Time>
<TimeTick>1462351602</TimeTick>
<NodeArgs eType="User" icon="6" nRep="97" status="Passed" >
<Disp><![CDATA[NavigatetoEditNonEdit]]></Disp>
</NodeArgs>
</Step>
<Step rID="T52">
<Obj plainTxt="False" ><![CDATA[Questions Editable/Non-Editabl]]></Obj>
<Details plainTxt="False" ><![CDATA[Browser]]></Details>
<Time><![CDATA[04-05-2016 - 14:19:16]]></Time>
<TimeTick>1462351756</TimeTick>
<Step rID="T53">
<Obj plainTxt="False" ><![CDATA[Questions Editable/Non-Editabl]]></Obj>
<Details plainTxt="False" ><![CDATA[Page]]></Details>
<Time><![CDATA[04-05-2016 - 14:19:16]]></Time>
<TimeTick>1462351756</TimeTick>
<Step rID="T54">
<Obj plainTxt="False" ><![CDATA["LBL_MakeQuestionsNonEditable"- Description mismatch]]></Obj>
<Details plainTxt="False" ><![CDATA[The object was not found using the test object description. Check the object's properties.]]></Details>
<Time><![CDATA[04-05-2016 - 14:19:16]]></Time>
<TimeTick>1462351756</TimeTick>
<NodeArgs eType="Replay" icon="10" nRep="233" status="Warning" Source="C:\IFSAutomation\Branch_IFS_Documents_Final\Branch_IFS_Documents_Final\Libraries\GeneralLibraries\RegisteredFunctions.vbs" SourceLine="140" >
<Disp><![CDATA["LBL_MakeQuestionsNonEditable"- Description mismatch]]></Disp>
</NodeArgs>
</Step>
<Step rID="T55">
<Obj plainTxt="False" ><![CDATA["LBL_MakeQuestionsNonEditable"- Smart Identification]]></Obj>
<Details plainTxt="False" ><![CDATA[<P><span class="text">The smart identification mechanism was invoked.</span></P><P><SPAN class=text>Reason: object not found.</SPAN></P>           <SPAN class=text><b>Original description:</b></SPAN><br>micclass=WebElement<br>innertext=Make Questions EditableThis page tests editable/not-editable rule for all data types. Select Yes on toggles to make non-editable, Select No on toggle to make editable again.<br>html tag=DIV<br><P><FONT face=Verdana size=2><SPAN class=text><B>Smart Identification Alternative Description: </B></SPAN></FONT></P><FONT face=Verdana size=2><u>Base filter properties (728 objects found)&nbsp;</FONT></u><br>
micclass=WebElement<br>html tag=DIV<br><br><FONT face=Verdana size=2><u>Optional filter properties</FONT></u><br>
html id=<SPAN class=passed> (Used</SPAN>, 625 matches)</SPAN><br>class=page-header ifs-page-message<SPAN class=passed> (Used</SPAN>, 1 matches)</SPAN><br>innertext=Make Questions EditableThis page tests editable/not-editable rule for all data types. Select Yes on toggles to make non-editable, Select No on toggle to make editable again.<SPAN class=warning> (Ignored)<FONT color=#000000></FONT></SPAN><br>visible=1<SPAN class=warning> (Ignored)<FONT color=#000000></FONT></SPAN><br>]]></Details>
<Time><![CDATA[04-05-2016 - 14:19:16]]></Time>
<TimeTick>1462351756</TimeTick>
<NodeArgs eType="Replay" icon="11" nRep="234" Source="C:\IFSAutomation\Branch_IFS_Documents_Final\Branch_IFS_Documents_Final\Libraries\GeneralLibraries\RegisteredFunctions.vbs" SourceLine="140" >
<Disp><![CDATA["LBL_MakeQuestionsNonEditable"- Smart Identification]]></Disp>
</NodeArgs>
</Step>
<Step rID="T56">
<Obj plainTxt="False" ><![CDATA[LBL_MakeQuestionsNonEditable.Exist]]></Obj>
<Details plainTxt="False" ><![CDATA["Object exists"]]></Details>
<Time><![CDATA[04-05-2016 - 14:19:16]]></Time>
<TimeTick>1462351756</TimeTick>
<NodeArgs eType="Replay" icon="10" nRep="235" Source="C:\IFSAutomation\Branch_IFS_Documents_Final\Branch_IFS_Documents_Final\Libraries\GeneralLibraries\RegisteredFunctions.vbs" SourceLine="140" >
<Disp><![CDATA[LBL_MakeQuestionsNonEditable.Exist]]></Disp>
</NodeArgs>
</Step>
<NodeArgs eType="Context" icon="7" nRep="232" status="Warning" Source="C:\IFSAutomation\Branch_IFS_Documents_Final\Branch_IFS_Documents_Final\Libraries\GeneralLibraries\RegisteredFunctions.vbs" SourceLine="140" >
<Disp><![CDATA[Questions Editable/Non-Editabl]]></Disp>
</NodeArgs>
</Step>
<NodeArgs eType="Context" icon="5" nRep="231" status="Warning" Source="C:\IFSAutomation\Branch_IFS_Documents_Final\Branch_IFS_Documents_Final\Libraries\GeneralLibraries\RegisteredFunctions.vbs" SourceLine="140" >
<Disp><![CDATA[Questions Editable/Non-Editabl]]></Disp>
</NodeArgs>
</Step>
<Step rID="T57">
<Obj ><![CDATA[EditNonEdit_ValidateToggles]]></Obj>
<Details ><![CDATA[]]></Details>
<Time><![CDATA[04-05-2016 - 14:19:38]]></Time>
<TimeTick>1462351778</TimeTick>
<NodeArgs eType="User" icon="6" nRep="236" status="Passed" Source="C:\IFSAutomation\Branch_IFS_Documents_Final\Branch_IFS_Documents_Final\Libraries\GeneralLibraries\ReportingLib.vbs" SourceLine="85" >
<Disp><![CDATA[EditNonEdit_ValidateToggles]]></Disp>
</NodeArgs>
</Step>
<Step rID="T58">
<Obj plainTxt="False" ><![CDATA[Questions Editable/Non-Editabl]]></Obj>
<Details plainTxt="False" ><![CDATA[Browser]]></Details>
<Time><![CDATA[04-05-2016 - 14:21:45]]></Time>
<TimeTick>1462351905</TimeTick>
<Step rID="T59">
<Obj plainTxt="False" ><![CDATA[Questions Editable/Non-Editabl]]></Obj>
<Details plainTxt="False" ><![CDATA[Page]]></Details>
<Time><![CDATA[04-05-2016 - 14:21:45]]></Time>
<TimeTick>1462351905</TimeTick>
<Step rID="T60">
<Obj plainTxt="False" ><![CDATA["LBL_MakeQuestionsNonEditable"- Description mismatch]]></Obj>
<Details plainTxt="False" ><![CDATA[The object was not found using the test object description. Check the object's properties.]]></Details>
<Time><![CDATA[04-05-2016 - 14:21:45]]></Time>
<TimeTick>1462351905</TimeTick>
<NodeArgs eType="Replay" icon="10" nRep="390" status="Warning" Source="C:\IFSAutomation\Branch_IFS_Documents_Final\Branch_IFS_Documents_Final\Libraries\GeneralLibraries\RegisteredFunctions.vbs" SourceLine="104" >
<Disp><![CDATA["LBL_MakeQuestionsNonEditable"- Description mismatch]]></Disp>
</NodeArgs>
</Step>
<Step rID="T61">
<Obj plainTxt="False" ><![CDATA["LBL_MakeQuestionsNonEditable"- Smart Identification]]></Obj>
<Details plainTxt="False" ><![CDATA[<P><span class="text">The smart identification mechanism was invoked.</span></P><P><SPAN class=text>Reason: object not found.</SPAN></P>           <SPAN class=text><b>Original description:</b></SPAN><br>micclass=WebElement<br>innertext=Make Questions EditableThis page tests editable/not-editable rule for all data types. Select Yes on toggles to make non-editable, Select No on toggle to make editable again.<br>html tag=DIV<br><P><FONT face=Verdana size=2><SPAN class=text><B>Smart Identification Alternative Description: </B></SPAN></FONT></P><FONT face=Verdana size=2><u>Base filter properties (728 objects found)&nbsp;</FONT></u><br>
micclass=WebElement<br>html tag=DIV<br><br><FONT face=Verdana size=2><u>Optional filter properties</FONT></u><br>
html id=<SPAN class=passed> (Used</SPAN>, 625 matches)</SPAN><br>class=page-header ifs-page-message<SPAN class=passed> (Used</SPAN>, 1 matches)</SPAN><br>innertext=Make Questions EditableThis page tests editable/not-editable rule for all data types. Select Yes on toggles to make non-editable, Select No on toggle to make editable again.<SPAN class=warning> (Ignored)<FONT color=#000000></FONT></SPAN><br>visible=1<SPAN class=warning> (Ignored)<FONT color=#000000></FONT></SPAN><br>]]></Details>
<Time><![CDATA[04-05-2016 - 14:21:45]]></Time>
<TimeTick>1462351905</TimeTick>
<NodeArgs eType="Replay" icon="11" nRep="391" Source="C:\IFSAutomation\Branch_IFS_Documents_Final\Branch_IFS_Documents_Final\Libraries\GeneralLibraries\RegisteredFunctions.vbs" SourceLine="104" >
<Disp><![CDATA["LBL_MakeQuestionsNonEditable"- Smart Identification]]></Disp>
</NodeArgs>
</Step>
<Step rID="T62">
<Obj plainTxt="False" ><![CDATA[LBL_MakeQuestionsNonEditable.Exist]]></Obj>
<Details plainTxt="False" ><![CDATA["Object exists"]]></Details>
<Time><![CDATA[04-05-2016 - 14:21:45]]></Time>
<TimeTick>1462351905</TimeTick>
<NodeArgs eType="Replay" icon="10" nRep="392" Source="C:\IFSAutomation\Branch_IFS_Documents_Final\Branch_IFS_Documents_Final\Libraries\GeneralLibraries\RegisteredFunctions.vbs" SourceLine="104" >
<Disp><![CDATA[LBL_MakeQuestionsNonEditable.Exist]]></Disp>
</NodeArgs>
</Step>
<NodeArgs eType="Context" icon="7" nRep="389" status="Warning" Source="C:\IFSAutomation\Branch_IFS_Documents_Final\Branch_IFS_Documents_Final\Libraries\GeneralLibraries\RegisteredFunctions.vbs" SourceLine="104" >
<Disp><![CDATA[Questions Editable/Non-Editabl]]></Disp>
</NodeArgs>
</Step>
<NodeArgs eType="Context" icon="5" nRep="388" status="Warning" Source="C:\IFSAutomation\Branch_IFS_Documents_Final\Branch_IFS_Documents_Final\Libraries\GeneralLibraries\RegisteredFunctions.vbs" SourceLine="104" >
<Disp><![CDATA[Questions Editable/Non-Editabl]]></Disp>
</NodeArgs>
</Step>
<Step rID="T63">
<Obj ><![CDATA[EditNonEdit_ValidateToggles]]></Obj>
<Details ><![CDATA[]]></Details>
<Time><![CDATA[04-05-2016 - 14:22:27]]></Time>
<TimeTick>1462351947</TimeTick>
<NodeArgs eType="User" icon="6" nRep="393" status="Passed" Source="C:\IFSAutomation\Branch_IFS_Documents_Final\Branch_IFS_Documents_Final\Libraries\GeneralLibraries\ReportingLib.vbs" SourceLine="85" >
<Disp><![CDATA[EditNonEdit_ValidateToggles]]></Disp>
</NodeArgs>
</Step>
<Step rID="T64">
<Obj plainTxt="False" ><![CDATA[Questions Editable/Non-Editabl]]></Obj>
<Details plainTxt="False" ><![CDATA[Browser]]></Details>
<Time><![CDATA[04-05-2016 - 14:23:01]]></Time>
<TimeTick>1462351981</TimeTick>
<Step rID="T65">
<Obj plainTxt="False" ><![CDATA[Questions Editable/Non-Editabl]]></Obj>
<Details plainTxt="False" ><![CDATA[Page]]></Details>
<Time><![CDATA[04-05-2016 - 14:23:01]]></Time>
<TimeTick>1462351981</TimeTick>
<Step rID="T66">
<Obj plainTxt="False" ><![CDATA[TWL_Numeric.Exist]]></Obj>
<Details plainTxt="False" ><![CDATA["Object exists"]]></Details>
<Time><![CDATA[04-05-2016 - 14:23:01]]></Time>
<TimeTick>1462351981</TimeTick>